ticker,executive,company,published_at,title,description,content,source,url,data_source
TSLA,Elon Musk,Tesla,20231218T231500Z,"Musk , Disney , Moms for Liberty : Holiday Cheer Is Scarce in Florida","Musk , Disney , Moms for Liberty : Holiday Cheer Is Scarce in Florida","Musk , Disney , Moms for Liberty : Holiday Cheer Is Scarce in Florida",bloomberg.com,https://www.bloomberg.com/opinion/articles/2023-12-18/musk-disney-moms-for-liberty-holiday-cheer-is-scarce-in-florida-lqbiefjy,gdelt
TSLA,Elon Musk,Tesla,20231019T233000Z,"머스크 수요 둔화 경고 , 테슬라 9 % 등 전기차 일제 급락 ( 종합2 ) ","머스크 수요 둔화 경고 , 테슬라 9 % 등 전기차 일제 급락 ( 종합2 ) ","머스크 수요 둔화 경고 , 테슬라 9 % 등 전기차 일제 급락 ( 종합2 ) ",news1.kr,https://www.news1.kr/articles/?5204860,gdelt
TSLA,Elon Musk,Tesla,20231024T003000Z,중국의 테슬라 협력업체들 줄줄이 멕시코 진출,중국의 테슬라 협력업체들 줄줄이 멕시코 진출,중국의 테슬라 협력업체들 줄줄이 멕시코 진출,newspim.com,https://www.newspim.com/news/view/20231024000056,gdelt
TSLA,Elon Musk,Tesla,20231020T030000Z,Tesla dug its own grave with wild Cybertruck design - Elon Musk,Tesla dug its own grave with wild Cybertruck design - Elon Musk,Tesla dug its own grave with wild Cybertruck design - Elon Musk,northweststar.com.au,https://www.northweststar.com.au/story/8393742/tesla-dug-its-own-grave-with-wild-cybertruck-design-elon-musk/?cs=34616,gdelt
TSLA,Elon Musk,Tesla,20231020T031500Z,Tesla dug its own grave with wild Cybertruck design - Elon Musk,Tesla dug its own grave with wild Cybertruck design - Elon Musk,Tesla dug its own grave with wild Cybertruck design - Elon Musk,moreechampion.com.au,https://www.moreechampion.com.au/story/8393742/tesla-dug-its-own-grave-with-wild-cybertruck-design-elon-musk/?cs=34616,gdelt
TSLA,Elon Musk,Tesla,20231020T031500Z,Tesla dug its own grave with wild Cybertruck design - Elon Musk,Tesla dug its own grave with wild Cybertruck design - Elon Musk,Tesla dug its own grave with wild Cybertruck design - Elon Musk,stawelltimes.com.au,https://www.stawelltimes.com.au/story/8393742/tesla-dug-its-own-grave-with-wild-cybertruck-design-elon-musk/?cs=34616,gdelt
TSLA,Elon Musk,Tesla,20231020T031500Z,Tesla dug its own grave with wild Cybertruck design - Elon Musk,Tesla dug its own grave with wild Cybertruck design - Elon Musk,Tesla dug its own grave with wild Cybertruck design - Elon Musk,hardenexpress.com.au,https://www.hardenexpress.com.au/story/8393742/tesla-dug-its-own-grave-with-wild-cybertruck-design-elon-musk/?cs=34616,gdelt
TSLA,Elon Musk,Tesla,20231111T074500Z,  잡스 이어 머스크 전기도 영화로 … 테슬라 성장 뒷얘기 나올까 - 헤럴드경제,  잡스 이어 머스크 전기도 영화로 … 테슬라 성장 뒷얘기 나올까 - 헤럴드경제,  잡스 이어 머스크 전기도 영화로 … 테슬라 성장 뒷얘기 나올까 - 헤럴드경제,biz.heraldcorp.com,http://biz.heraldcorp.com/view.php?ud=20231111000056,gdelt
TSLA,Elon Musk,Tesla,20231110T074500Z,HSBC  머스크는 자산이자 리스크  지적에 … 테슬라 주가 5 % 대 급락,HSBC  머스크는 자산이자 리스크  지적에 … 테슬라 주가 5 % 대 급락,HSBC  머스크는 자산이자 리스크  지적에 … 테슬라 주가 5 % 대 급락,ddaily.co.kr,https://www.ddaily.co.kr/page/view/2023111011124901932,gdelt
TSLA,Elon Musk,Tesla,20231109T230000Z,"HSBC  CEO 리스크 크다  테슬라 등급 강등 , 주가 6 % ↓ ( 종합 ) ","HSBC  CEO 리스크 크다  테슬라 등급 강등 , 주가 6 % ↓ ( 종합 ) ","HSBC  CEO 리스크 크다  테슬라 등급 강등 , 주가 6 % ↓ ( 종합 ) ",news1.kr,https://www.news1.kr/articles/?5226838,gdelt
TSLA,Elon Musk,Tesla,20231123T203000Z,"머스크 , 스웨덴 테슬라 정비사 파업 · 노동계 동조에  미친짓  ","머스크 , 스웨덴 테슬라 정비사 파업 · 노동계 동조에  미친짓  ","머스크 , 스웨덴 테슬라 정비사 파업 · 노동계 동조에  미친짓  ",yna.co.kr,https://www.yna.co.kr/view/AKR20231124002700075,gdelt
TSLA,Elon Musk,Tesla,20231213T011500Z,"  머스크의 X , 올해 광고 수입 3조원대 추정 … 작년의 반토막  ","  머스크의 X , 올해 광고 수입 3조원대 추정 … 작년의 반토막  ","  머스크의 X , 올해 광고 수입 3조원대 추정 … 작년의 반토막  ",yna.co.kr,https://www.yna.co.kr/view/AKR20231213028400075,gdelt
TSLA,Elon Musk,Tesla,20231212T071500Z,머스크  내년 초엔 엑스로 영상통화 하세요  ,머스크  내년 초엔 엑스로 영상통화 하세요  ,머스크  내년 초엔 엑스로 영상통화 하세요  ,etnews.com,https://www.etnews.com/20231212000200?mc=em_050_00010,gdelt
TSLA,Elon Musk,Tesla,20231212T061500Z,머스크  내년 초엔 엑스로 영상통화 하세요  ,머스크  내년 초엔 엑스로 영상통화 하세요  ,머스크  내년 초엔 엑스로 영상통화 하세요  ,etnews.com,https://www.etnews.com/20231212000200?mc=em_050_00007,gdelt
TSLA,Elon Musk,Tesla,20231212T063000Z,머스크  내년 초엔 엑스로 영상통화 하세요  ,머스크  내년 초엔 엑스로 영상통화 하세요  ,머스크  내년 초엔 엑스로 영상통화 하세요  ,etnews.com,https://www.etnews.com/20231212000200?mc=em_050_00009,gdelt
TSLA,Elon Musk,Tesla,20231212T053000Z,머스크  내년 초엔 엑스로 영상통화 하세요  ,머스크  내년 초엔 엑스로 영상통화 하세요  ,머스크  내년 초엔 엑스로 영상통화 하세요  ,etnews.com,https://www.etnews.com/20231212000200?mc=em_310_00002,gdelt
TSLA,Elon Musk,Tesla,20231212T053000Z,머스크  내년 초엔 엑스로 영상통화 하세요  ,머스크  내년 초엔 엑스로 영상통화 하세요  ,머스크  내년 초엔 엑스로 영상통화 하세요  ,etnews.com,https://www.etnews.com/20231212000200?mc=em_050_00005,gdelt
TSLA,Elon Musk,Tesla,20231230T023000Z,"테슬라 올해 120 % 폭등 , 전기차 대세 입증 [ 미증시 결산 - ③ ] ","테슬라 올해 120 % 폭등 , 전기차 대세 입증 [ 미증시 결산 - ③ ] ","테슬라 올해 120 % 폭등 , 전기차 대세 입증 [ 미증시 결산 - ③ ] ",news1.kr,https://www.news1.kr/articles/?5276162,gdelt
TSLA,Elon Musk,Tesla,20231019T221500Z,  폭풍이 몰려온다  테슬라 암울한 전망에 월가 실망 … 주가 급락,  폭풍이 몰려온다  테슬라 암울한 전망에 월가 실망 … 주가 급락,  폭풍이 몰려온다  테슬라 암울한 전망에 월가 실망 … 주가 급락,yna.co.kr,https://www.yna.co.kr/view/AKR20231020005400075,gdelt
TSLA,Elon Musk,Tesla,20231228T044500Z,Two US senators call for Tesla recalls after Reuters investigation,Two US senators call for Tesla recalls after Reuters investigation,Two US senators call for Tesla recalls after Reuters investigation,article.wn.com,https://article.wn.com/view/2023/12/28/Two_US_senators_call_for_Tesla_recalls_after_Reuters_investi/,gdelt
TSLA,Elon Musk,Tesla,20231118T001500Z,"머스크 반유대주의 발언 일파만파 , 백악관까지 나서 비판","머스크 반유대주의 발언 일파만파 , 백악관까지 나서 비판","머스크 반유대주의 발언 일파만파 , 백악관까지 나서 비판",news1.kr,https://www.news1.kr/articles/?5235207,gdelt
TSLA,Elon Musk,Tesla,20231225T023000Z,"  테슬라 · 스페이스X · 트위터 … 일론 머스크 정치적 영향력 , 올해 더 커졌다 - 헤럴드경제","  테슬라 · 스페이스X · 트위터 … 일론 머스크 정치적 영향력 , 올해 더 커졌다 - 헤럴드경제","  테슬라 · 스페이스X · 트위터 … 일론 머스크 정치적 영향력 , 올해 더 커졌다 - 헤럴드경제",biz.heraldcorp.com,http://biz.heraldcorp.com/view.php?ud=20231225000026,gdelt
TSLA,Elon Musk,Tesla,20231229T200000Z,"Combined net worth of 500 richest surges by $1 . 5 trn in 2023 , Musk leads","Combined net worth of 500 richest surges by $1 . 5 trn in 2023 , Musk leads","Combined net worth of 500 richest surges by $1 . 5 trn in 2023 , Musk leads",business-standard.com,https://www.business-standard.com/world-news/combined-net-worth-of-500-richest-surges-by-1-5-trn-in-2023-musk-leads-123122901146_1.html,gdelt
TSLA,Elon Musk,Tesla,20231110T093000Z,"Thailand Toyota Ev Industry : Thailand , Toyota to jointly develop domestic EV industry , ET BrandEquity","Thailand Toyota Ev Industry : Thailand , Toyota to jointly develop domestic EV industry , ET BrandEquity","Thailand Toyota Ev Industry : Thailand , Toyota to jointly develop domestic EV industry , ET BrandEquity",brandequity.economictimes.indiatimes.com,https://brandequity.economictimes.indiatimes.com/news/business-of-brands/thailand-toyota-to-jointly-develop-domestic-ev-industry/105115959,gdelt
TSLA,Elon Musk,Tesla,20231227T073000Z,  작년 테슬라 공장서 100명 중 5명꼴 부상 … 로봇 공격 사례도  ,  작년 테슬라 공장서 100명 중 5명꼴 부상 … 로봇 공격 사례도  ,  작년 테슬라 공장서 100명 중 5명꼴 부상 … 로봇 공격 사례도  ,yna.co.kr,https://www.yna.co.kr/view/AKR20231227117400009,gdelt
TSLA,Elon Musk,Tesla,20231018T223000Z,"테슬라 사이버트럭 , 11월30일 출시 … 머스크  기대치 낮춰라  ","테슬라 사이버트럭 , 11월30일 출시 … 머스크  기대치 낮춰라  ","테슬라 사이버트럭 , 11월30일 출시 … 머스크  기대치 낮춰라  ",news.mt.co.kr,https://news.mt.co.kr/mtview.php?no=2023101906502384142&MS2_T,gdelt
TSLA,Elon Musk,Tesla,20231019T001500Z,"테슬라 사이버트럭 , 11월30일 출시 … 머스크  기대치 낮춰라  ","테슬라 사이버트럭 , 11월30일 출시 … 머스크  기대치 낮춰라  ","테슬라 사이버트럭 , 11월30일 출시 … 머스크  기대치 낮춰라  ",news.mt.co.kr,https://news.mt.co.kr/mtview.php?no=2023101906502384142&MTS_P,gdelt
TSLA,Elon Musk,Tesla,20231214T214500Z,"  머스크 , 텍사스에 대학 설립 추진 … 약 1억달러 투입  ","  머스크 , 텍사스에 대학 설립 추진 … 약 1억달러 투입  ","  머스크 , 텍사스에 대학 설립 추진 … 약 1억달러 투입  ",koreatimes.com,http://www.koreatimes.com/article/20231214/1493621,gdelt
TSLA,Elon Musk,Tesla,20231228T223000Z,올해도 화제 몰고다닌 머스크 … 세기의 격투 허풍에 공개욕설까지,올해도 화제 몰고다닌 머스크 … 세기의 격투 허풍에 공개욕설까지,올해도 화제 몰고다닌 머스크 … 세기의 격투 허풍에 공개욕설까지,yna.co.kr,https://www.yna.co.kr/view/AKR20231229002600075,gdelt
TSLA,Elon Musk,Tesla,20231224T020000Z,"머스크 ,  反워크  AI챗봇 호언했지만 … 그록 답은  바이든에 투표  ","머스크 ,  反워크  AI챗봇 호언했지만 … 그록 답은  바이든에 투표  ","머스크 ,  反워크  AI챗봇 호언했지만 … 그록 답은  바이든에 투표  ",yna.co.kr,https://www.yna.co.kr/view/AKR20231224010500075,gdelt
TSLA,Elon Musk,Tesla,20231013T081500Z,엑스  유해 콘텐츠 수백만 계정 삭제  발버둥에도 ...  규제의 칼  빼든 EU,엑스  유해 콘텐츠 수백만 계정 삭제  발버둥에도 ...  규제의 칼  빼든 EU,엑스  유해 콘텐츠 수백만 계정 삭제  발버둥에도 ...  규제의 칼  빼든 EU,hankookilbo.com,https://www.hankookilbo.com/News/Read/A2023101310510004734,gdelt
TSLA,Elon Musk,Tesla,20231006T021500Z,"美 SEC , 일론 머스크에 또 소송 … 트위터 인수조사 소환 불응  ","美 SEC , 일론 머스크에 또 소송 … 트위터 인수조사 소환 불응  ","美 SEC , 일론 머스크에 또 소송 … 트위터 인수조사 소환 불응  ",zdnet.co.kr,https://zdnet.co.kr/view/?no=20231006092601,gdelt
TSLA,Elon Musk,Tesla,20231215T061500Z,"France new EV cash incentive rules toughen market for Chinese - made cars , ET Auto","France new EV cash incentive rules toughen market for Chinese - made cars , ET Auto","France new EV cash incentive rules toughen market for Chinese - made cars , ET Auto",auto.economictimes.indiatimes.com,https://auto.economictimes.indiatimes.com/news/passenger-vehicle/frances-new-ev-cash-incentive-rules-toughen-market-for-chinese-made-cars/106010950,gdelt
TSLA,Elon Musk,Tesla,20231016T104500Z,The Wobbles Showing a Bleak Outlook for China Weaker EV Makers,The Wobbles Showing a Bleak Outlook for China Weaker EV Makers,The Wobbles Showing a Bleak Outlook for China Weaker EV Makers,bloomberg.com,https://www.bloomberg.com/news/articles/2023-10-16/the-wobbles-showing-a-bleak-outlook-for-china-s-weaker-ev-makers,gdelt
TSLA,Elon Musk,Tesla,20231126T034500Z,"음모론 심취한 머스크 X , 광고주 이탈로 수백 억 손실 위기","음모론 심취한 머스크 X , 광고주 이탈로 수백 억 손실 위기","음모론 심취한 머스크 X , 광고주 이탈로 수백 억 손실 위기",hankookilbo.com,https://www.hankookilbo.com/News/Read/A2023112610060001537,gdelt
TSLA,Elon Musk,Tesla,20231218T154500Z,Tesla Recalls Cant Stop The Rally ( NASDAQ : TSLA ) ,Tesla Recalls Cant Stop The Rally ( NASDAQ : TSLA ) ,Tesla Recalls Cant Stop The Rally ( NASDAQ : TSLA ) ,seekingalpha.com,https://seekingalpha.com/article/4658439-tesla-recalls-cant-stop-stock-rally,gdelt
TSLA,Elon Musk,Tesla,20231029T043000Z,"일론 머스크 , 가자지구 SOS에 응답 …  구호단체 지원  ","일론 머스크 , 가자지구 SOS에 응답 …  구호단체 지원  ","일론 머스크 , 가자지구 SOS에 응답 …  구호단체 지원  ",hankookilbo.com,https://www.hankookilbo.com/News/Read/A2023102909330000711,gdelt
TSLA,Elon Musk,Tesla,20231112T094500Z,"일론 머스크 일생 , 할리우드 영화로 제작된다 … 블랙스완  감독 메가폰","일론 머스크 일생 , 할리우드 영화로 제작된다 … 블랙스완  감독 메가폰","일론 머스크 일생 , 할리우드 영화로 제작된다 … 블랙스완  감독 메가폰",etoday.co.kr,https://www.etoday.co.kr/news/view/2301497,gdelt
TSLA,Elon Musk,Tesla,20231206T043000Z,노조에 골치 아픈 머스크 … 북유럽서 테슬라 운송 중단 위기,노조에 골치 아픈 머스크 … 북유럽서 테슬라 운송 중단 위기,노조에 골치 아픈 머스크 … 북유럽서 테슬라 운송 중단 위기,edaily.co.kr,https://www.edaily.co.kr/news/read?newsId=02243526635835896&mediaCodeNo=257,gdelt
TSLA,Elon Musk,Tesla,20231003T073000Z,China electric cars reinvent the wheel for good : podcast,China electric cars reinvent the wheel for good : podcast,China electric cars reinvent the wheel for good : podcast,reuters.com,https://www.reuters.com/breakingviews/chinas-electric-cars-reinvent-wheel-good-podcast-2023-10-03/,gdelt
TSLA,Elon Musk,Tesla,20231206T223000Z,"머스크  모델2 , 오스틴서 생산 시작할 것 … 2024년 출시설  모락  ","머스크  모델2 , 오스틴서 생산 시작할 것 … 2024년 출시설  모락  ","머스크  모델2 , 오스틴서 생산 시작할 것 … 2024년 출시설  모락  ",newspim.com,https://www.newspim.com/news/view/20231206001059,gdelt
TSLA,Elon Musk,Tesla,20231201T001500Z,Elon Musk warns Tesla could be swamped by Chinese electric car brands,Elon Musk warns Tesla could be swamped by Chinese electric car brands,Elon Musk warns Tesla could be swamped by Chinese electric car brands,theadvocate.com.au,https://www.theadvocate.com.au/story/8443963/elon-musk-warns-tesla-could-be-swamped-by-chinese-electric-car-brands/?cs=34616,gdelt
TSLA,Elon Musk,Tesla,20231218T221500Z,"  EU ,  가짜뉴스 유통  의혹 X에  SNS 규제법  첫 조사 개시 - 헤럴드경제","  EU ,  가짜뉴스 유통  의혹 X에  SNS 규제법  첫 조사 개시 - 헤럴드경제","  EU ,  가짜뉴스 유통  의혹 X에  SNS 규제법  첫 조사 개시 - 헤럴드경제",biz.heraldcorp.com,http://biz.heraldcorp.com/view.php?ud=20231219000012,gdelt
TSLA,Elon Musk,Tesla,20231005T023000Z,美 고용지표  반토막  에 월가  훈풍 · 테슬라 6 % ↑ [ 뉴욕증시 읽어드림 ] ,美 고용지표  반토막  에 월가  훈풍 · 테슬라 6 % ↑ [ 뉴욕증시 읽어드림 ] ,美 고용지표  반토막  에 월가  훈풍 · 테슬라 6 % ↑ [ 뉴욕증시 읽어드림 ] ,seoul.co.kr,https://www.seoul.co.kr/news/newsView.php?id=20231005500041,gdelt
TSLA,Elon Musk,Tesla,20231030T011500Z,머스크  가자지구에 스타링크 제공 … 이스라엘  맞서 싸우겠다  반발,머스크  가자지구에 스타링크 제공 … 이스라엘  맞서 싸우겠다  반발,머스크  가자지구에 스타링크 제공 … 이스라엘  맞서 싸우겠다  반발,news1.kr,https://www.news1.kr/articles/?5214243,gdelt
TSLA,Elon Musk,Tesla,20231109T230000Z,"테슬라 5 . 46 %- 리비안 9 . 82 %, 전기차 일제 급락 ( 종합2 ) ","테슬라 5 . 46 %- 리비안 9 . 82 %, 전기차 일제 급락 ( 종합2 ) ","테슬라 5 . 46 %- 리비안 9 . 82 %, 전기차 일제 급락 ( 종합2 ) ",news1.kr,https://www.news1.kr/articles/?5226843,gdelt
TSLA,Elon Musk,Tesla,20231110T030000Z,  머스크는 자산이자 리스크 … 테슬라 주가 5 . 5 % 급락,  머스크는 자산이자 리스크 … 테슬라 주가 5 . 5 % 급락,  머스크는 자산이자 리스크 … 테슬라 주가 5 . 5 % 급락,etoday.co.kr,https://www.etoday.co.kr/news/view/2301116,gdelt
TSLA,Elon Musk,Tesla,20231206T060000Z,"머스크 CEO , 안판다던 비트코인 75 % 매각","머스크 CEO , 안판다던 비트코인 75 % 매각","머스크 CEO , 안판다던 비트코인 75 % 매각",kbench.com,https://kbench.com/?q=node/235370,gdelt
TSLA,Elon Musk,Tesla,20231208T003000Z,"머스크 , X에 광고 끊은 디즈니 또 저격 … CEO 해고돼야  ","머스크 , X에 광고 끊은 디즈니 또 저격 … CEO 해고돼야  ","머스크 , X에 광고 끊은 디즈니 또 저격 … CEO 해고돼야  ",yna.co.kr,https://www.yna.co.kr/view/AKR20231208006100075,gdelt
TSLA,Elon Musk,Tesla,20231002T163000Z,Elon Musk Tesla misses delivery estimates amid production delays,Elon Musk Tesla misses delivery estimates amid production delays,Elon Musk Tesla misses delivery estimates amid production delays,nypost.com,https://nypost.com/2023/10/02/elon-musks-tesla-misses-delivery-estimates-amid-production-delays/,gdelt
TSLA,Elon Musk,Tesla,20231108T030000Z,반값 테슬라 기대 … 3000만원대 전기차 생산 계획 밝혀,반값 테슬라 기대 … 3000만원대 전기차 생산 계획 밝혀,반값 테슬라 기대 … 3000만원대 전기차 생산 계획 밝혀,hankyung.com,https://www.hankyung.com/article/2023110800607,gdelt
TSLA,Elon Musk,Tesla,20231128T013000Z,"테슬라 사이버트럭 , 11월30일 출시 … 머스크","테슬라 사이버트럭 , 11월30일 출시 … 머스크","테슬라 사이버트럭 , 11월30일 출시 … 머스크",radiokorea.com,https://www.radiokorea.com:443/bulletin/bbs/board.php?bo_table=c_car_talk&wr_id=4090,gdelt
TSLA,Elon Musk,Tesla,20231103T171500Z,"  AI는 부조종사 , 사람 역할 필요   직업 필요없는 시대 올것  ｜동아일보","  AI는 부조종사 , 사람 역할 필요   직업 필요없는 시대 올것  ｜동아일보","  AI는 부조종사 , 사람 역할 필요   직업 필요없는 시대 올것  ｜동아일보",donga.com,https://www.donga.com/news/Inter/article/all/20231103/122015778/1,gdelt
TSLA,Elon Musk,Tesla,20231029T203000Z,Elon Musk Loses $30 Billion in 48 Hours Due to Tesla Slow Down,Elon Musk Loses $30 Billion in 48 Hours Due to Tesla Slow Down,Elon Musk Loses $30 Billion in 48 Hours Due to Tesla Slow Down,atlantablackstar.com,https://atlantablackstar.com/2023/10/29/elon-musk-loses-30-billion-in-48-hours-due-to-teslas-slow-down/,gdelt
TSLA,Elon Musk,Tesla,20231102T031500Z,미 · 중도 모여  AI 위험 막자  첫 공동선언 … 2회 회의는 韓서,미 · 중도 모여  AI 위험 막자  첫 공동선언 … 2회 회의는 韓서,미 · 중도 모여  AI 위험 막자  첫 공동선언 … 2회 회의는 韓서,news.mt.co.kr,https://news.mt.co.kr/mtview.php?no=2023110210030676024&type=2&sec=politics&pDepth2=Ptotal&MNE_T,gdelt
TSLA,Elon Musk,Tesla,20231017T030000Z,"IRA 세제혜택이 가른 판매량 … 테슬라 62 % ↑ , 폭스바겐 42 % ↑","IRA 세제혜택이 가른 판매량 … 테슬라 62 % ↑ , 폭스바겐 42 % ↑","IRA 세제혜택이 가른 판매량 … 테슬라 62 % ↑ , 폭스바겐 42 % ↑",news.mt.co.kr,https://news.mt.co.kr/mtview.php?no=2023101709101320064&type=2&sec=politics&pDepth2=Ptotal&MNE_T,gdelt
TSLA,Elon Musk,Tesla,20231025T100000Z,"  Not just number , Elon Musk goes emotional on Tesla earnings call ; Analysts call him  little baby  ","  Not just number , Elon Musk goes emotional on Tesla earnings call ; Analysts call him  little baby  ","  Not just number , Elon Musk goes emotional on Tesla earnings call ; Analysts call him  little baby  ",livemint.com,https://www.livemint.com/companies/news/not-just-numbers-elon-musk-goes-emotional-on-tesla-earnings-call-analysts-call-him-little-baby-11698217562780.html,gdelt
TSLA,Elon Musk,Tesla,20231201T001500Z,테슬라 1 . 66 %- 니콜라 3 . 72 % 전기차 일제 급락 ( 상보 ) ,테슬라 1 . 66 %- 니콜라 3 . 72 % 전기차 일제 급락 ( 상보 ) ,테슬라 1 . 66 %- 니콜라 3 . 72 % 전기차 일제 급락 ( 상보 ) ,news1.kr,https://www.news1.kr/articles/?5248133,gdelt
TSLA,Elon Musk,Tesla,20231105T101500Z,머스크式 생성형AI 챗봇 나온다  비꼬는 듯한 유머 감각 갖춰  ,머스크式 생성형AI 챗봇 나온다  비꼬는 듯한 유머 감각 갖춰  ,머스크式 생성형AI 챗봇 나온다  비꼬는 듯한 유머 감각 갖춰  ,newsway.co.kr,https://www.newsway.co.kr/news/view?ud=2023110516521850133,gdelt
TSLA,Elon Musk,Tesla,20231105T094500Z,머스크式 생성형AI 챗봇 나온다  비꼬는 듯한 유머 감각 갖춰  ,머스크式 생성형AI 챗봇 나온다  비꼬는 듯한 유머 감각 갖춰  ,머스크式 생성형AI 챗봇 나온다  비꼬는 듯한 유머 감각 갖춰  ,newsway.co.kr,https://newsway.co.kr/news/view?ud=2023110516521850133,gdelt
TSLA,Elon Musk,Tesla,20231228T201500Z,"2023년 매그니피센트7 , 엔비디아 · 메타 · 테슬라 · 아마존이  주도  ","2023년 매그니피센트7 , 엔비디아 · 메타 · 테슬라 · 아마존이  주도  ","2023년 매그니피센트7 , 엔비디아 · 메타 · 테슬라 · 아마존이  주도  ",edaily.co.kr,https://www.edaily.co.kr/news/read?newsId=01125046635843440&mediaCodeNo=257,gdelt
TSLA,Elon Musk,Tesla,20231127T023000Z,"  반유대 발언 수습 ? 머스크 , 27일 네타냐후 총리 등과 면담","  반유대 발언 수습 ? 머스크 , 27일 네타냐후 총리 등과 면담","  반유대 발언 수습 ? 머스크 , 27일 네타냐후 총리 등과 면담",newspim.com,https://www.newspim.com/news/view/20231127000111,gdelt
TSLA,Elon Musk,Tesla,20231101T210000Z,Elon Musk Tesla Triumphs in  Autopilot  Fatality Trial,Elon Musk Tesla Triumphs in  Autopilot  Fatality Trial,Elon Musk Tesla Triumphs in  Autopilot  Fatality Trial,breitbart.com,https://www.breitbart.com:443/tech/2023/11/01/elon-musks-tesla-triumphs-in-autopilot-fatality-trial/,gdelt
TSLA,Elon Musk,Tesla,20231103T161500Z,China to build humanoid robots by 2025,China to build humanoid robots by 2025,China to build humanoid robots by 2025,aol.com,https://www.aol.com/china-build-humanoid-robots-2025-144300923.html,gdelt
TSLA,Elon Musk,Tesla,20231106T141500Z,Tesla Affordable EV To Be Built In Germany - AutoSpies Auto News,Tesla Affordable EV To Be Built In Germany - AutoSpies Auto News,Tesla Affordable EV To Be Built In Germany - AutoSpies Auto News,autospies.com,https://www.autospies.com/news/index.aspx?submissionid=118866,gdelt
TSLA,Elon Musk,Tesla,20231103T134500Z,Chinese Tesla rival Nio cuts 10 % of workforce as CEO predicts  intense competition  – NBC Los Angeles,Chinese Tesla rival Nio cuts 10 % of workforce as CEO predicts  intense competition  – NBC Los Angeles,Chinese Tesla rival Nio cuts 10 % of workforce as CEO predicts  intense competition  – NBC Los Angeles,nbclosangeles.com,https://www.nbclosangeles.com/news/business/money-report/chinese-tesla-rival-nio-cuts-10-of-workforce-as-ceo-predicts-intense-competition/3259881/,gdelt
TSLA,Elon Musk,Tesla,20231111T073000Z,"머스크 , 도발적인 생성형 AI 유료버전 공개 … 연말 AI 대전  후끈  ","머스크 , 도발적인 생성형 AI 유료버전 공개 … 연말 AI 대전  후끈  ","머스크 , 도발적인 생성형 AI 유료버전 공개 … 연말 AI 대전  후끈  ",hankookilbo.com,https://www.hankookilbo.com/News/Read/A2023111014120005769,gdelt
TSLA,Elon Musk,Tesla,20231111T073000Z,"머스크 , 도발적인 생성형 AI 유료버전 공개 … 연말 AI 대전  후끈  ","머스크 , 도발적인 생성형 AI 유료버전 공개 … 연말 AI 대전  후끈  ","머스크 , 도발적인 생성형 AI 유료버전 공개 … 연말 AI 대전  후끈  ",hankookilbo.com,https://www.hankookilbo.com/News/Read/A2023111014120005769?topicView=y&stt_op=topic_main_toparea_view&stt_id=dfbea540-4d91-422a-b248-8c8143541f5f?topicView=y&stt_op=topic_main_toparea_view&stt_id=dfbea540-4d91-422a-b248-8c8143541f5f,gdelt
TSLA,Elon Musk,Tesla,20231103T134500Z,Chinese Tesla rival Nio cuts 10 % of workforce as CEO predicts  intense competition  – NBC10 Philadelphia,Chinese Tesla rival Nio cuts 10 % of workforce as CEO predicts  intense competition  – NBC10 Philadelphia,Chinese Tesla rival Nio cuts 10 % of workforce as CEO predicts  intense competition  – NBC10 Philadelphia,nbcphiladelphia.com,https://www.nbcphiladelphia.com/news/business/money-report/chinese-tesla-rival-nio-cuts-10-of-workforce-as-ceo-predicts-intense-competition/3685966/,gdelt
