ticker,executive,company,published_at,title,description,content,source,url,data_source
MSFT,Satya Nadella,Microsoft,20231122T071500Z,OpenAI brings Sam Altman back as CEO days after ouster,OpenAI brings Sam Altman back as CEO days after ouster,OpenAI brings Sam Altman back as CEO days after ouster,cnbc.com,https://www.cnbc.com/2023/11/22/openai-brings-sam-altman-back-as-ceo-days-after-ouster.html,gdelt
MSFT,Satya Nadella,Microsoft,20231123T144500Z,AI breakthrough that could threaten humanity might have been key to Sam Altman firing,AI breakthrough that could threaten humanity might have been key to Sam Altman firing,AI breakthrough that could threaten humanity might have been key to Sam Altman firing,bgr.com,https://bgr.com/tech/ai-breakthrough-that-could-threaten-humanity-might-have-been-key-to-sam-altmans-firing/,gdelt
MSFT,Satya Nadella,Microsoft,20231124T151500Z,What the real Frankenstein monster of AI and how do we control it ? ,What the real Frankenstein monster of AI and how do we control it ? ,What the real Frankenstein monster of AI and how do we control it ? ,alternet.org,https://www.alternet.org/whats-the-real-frankenstein-monster-of-ai-and-how-do-we-control-it/,gdelt
MSFT,Satya Nadella,Microsoft,20231224T123000Z,"국내 기업 , 생성형 AI 제품화 속도 ... 해외 진출 확대","국내 기업 , 생성형 AI 제품화 속도 ... 해외 진출 확대","국내 기업 , 생성형 AI 제품화 속도 ... 해외 진출 확대",zdnet.co.kr,https://zdnet.co.kr/view/?no=20231220102540,gdelt
MSFT,Satya Nadella,Microsoft,20231122T101500Z,"  올트먼 해임  재발 막자 … MS , 오픈AI 지배구조 변화 논의 중  – 라디오 서울","  올트먼 해임  재발 막자 … MS , 오픈AI 지배구조 변화 논의 중  – 라디오 서울","  올트먼 해임  재발 막자 … MS , 오픈AI 지배구조 변화 논의 중  – 라디오 서울",radioseoul1650.com,https://www.radioseoul1650.com/international/%EC%98%AC%ED%8A%B8%EB%A8%BC-%ED%95%B4%EC%9E%84-%EC%9E%AC%EB%B0%9C-%EB%A7%89%EC%9E%90ms-%EC%98%A4%ED%94%88ai-%EC%A7%80%EB%B0%B0%EA%B5%AC%EC%A1%B0-%EB%B3%80%ED%99%94/,gdelt
MSFT,Satya Nadella,Microsoft,20231125T153000Z,"ChatGPT Gift Ideas for Elon Musk , Sam Altman , and More Tech Execs","ChatGPT Gift Ideas for Elon Musk , Sam Altman , and More Tech Execs","ChatGPT Gift Ideas for Elon Musk , Sam Altman , and More Tech Execs",businessinsider.com,https://www.businessinsider.com/chatgpt-gift-ideas-elon-musk-sam-altman-zuckerberg-bezos-more-2023-11,gdelt
MSFT,Satya Nadella,Microsoft,20231122T071500Z,OpenAI brings Sam Altman back as CEO less than a week after he was fired by board,OpenAI brings Sam Altman back as CEO less than a week after he was fired by board,OpenAI brings Sam Altman back as CEO less than a week after he was fired by board,nbclosangeles.com,https://www.nbclosangeles.com/news/business/money-report/openai-brings-sam-altman-back-as-ceo-less-than-a-week-after-he-was-fired-by-board/3274620/,gdelt
MSFT,Satya Nadella,Microsoft,20231122T120000Z,OpenAI brings Sam Altman back as CEO less than a week after he was fired by board,OpenAI brings Sam Altman back as CEO less than a week after he was fired by board,OpenAI brings Sam Altman back as CEO less than a week after he was fired by board,nbcbayarea.com,https://www.nbcbayarea.com/news/business/money-report/openai-brings-sam-altman-back-as-ceo-less-than-a-week-after-he-was-fired-by-board/3378579/,gdelt
MSFT,Satya Nadella,Microsoft,20231122T071500Z,OpenAI brings Sam Altman back as CEO less than a week after he was fired by board,OpenAI brings Sam Altman back as CEO less than a week after he was fired by board,OpenAI brings Sam Altman back as CEO less than a week after he was fired by board,nbcmiami.com,https://www.nbcmiami.com/news/business/money-report/openai-brings-sam-altman-back-as-ceo-less-than-a-week-after-he-was-fired-by-board/3166422/,gdelt
MSFT,Satya Nadella,Microsoft,20231015T084500Z,Communication is Key : How Strong Interpersonal Skills Elevate Product Managers,Communication is Key : How Strong Interpersonal Skills Elevate Product Managers,Communication is Key : How Strong Interpersonal Skills Elevate Product Managers,economictimes.indiatimes.com,https://economictimes.indiatimes.com/jobs/c-suite/communication-is-key-how-strong-interpersonal-skills-elevate-product-managers/articleshow/104440011.cms,gdelt
MSFT,Satya Nadella,Microsoft,20231211T070000Z,Inside OpenAI crisis over the future of Artificial Intelligence | Technology News,Inside OpenAI crisis over the future of Artificial Intelligence | Technology News,Inside OpenAI crisis over the future of Artificial Intelligence | Technology News,indianexpress.com,https://indianexpress.com/article/technology/artificial-intelligence/inside-openais-crisis-over-the-future-of-artificial-intelligence-9063065/,gdelt
MSFT,Satya Nadella,Microsoft,20231023T063000Z,How generative AI could change the landscape of learning in rural India for students,How generative AI could change the landscape of learning in rural India for students,How generative AI could change the landscape of learning in rural India for students,financialexpress.com,https://www.financialexpress.com/jobs-career/education-how-generative-ai-could-change-the-landscape-of-learning-in-rural-india-for-students-3284203/,gdelt
MSFT,Satya Nadella,Microsoft,20231126T200000Z,בכי והמכתב שהכריע : מאחורי הקלעים של הדרמה בעולם ההייטק,בכי והמכתב שהכריע : מאחורי הקלעים של הדרמה בעולם ההייטק,בכי והמכתב שהכריע : מאחורי הקלעים של הדרמה בעולם ההייטק,globes.co.il,https://www.globes.co.il/news/article.aspx?did=1001463274,gdelt
MSFT,Satya Nadella,Microsoft,20231003T034500Z,Microsoft CEO Says Google Unfair Practices Led To Its Search Engine Dominance,Microsoft CEO Says Google Unfair Practices Led To Its Search Engine Dominance,Microsoft CEO Says Google Unfair Practices Led To Its Search Engine Dominance,theyeshivaworld.com,https://www.theyeshivaworld.com/news/general/2228830/microsoft-ceo-says-googles-unfair-practices-led-to-its-search-engine-dominance.html,gdelt
MSFT,Satya Nadella,Microsoft,20231209T050000Z,OpenAI : Inside OpenAI crisis over the future of artificial intelligence,OpenAI : Inside OpenAI crisis over the future of artificial intelligence,OpenAI : Inside OpenAI crisis over the future of artificial intelligence,economictimes.indiatimes.com,https://economictimes.indiatimes.com/tech/technology/inside-openais-crisis-over-the-future-of-artificial-intelligence/articleshow/105853972.cms,gdelt
MSFT,Satya Nadella,Microsoft,20231125T171500Z,"What can you buy a billionaire who has it all ? I asked ChatGPT for gift ideas for Sam Altman , Elon Musk , and other tech execs . ","What can you buy a billionaire who has it all ? I asked ChatGPT for gift ideas for Sam Altman , Elon Musk , and other tech execs . ","What can you buy a billionaire who has it all ? I asked ChatGPT for gift ideas for Sam Altman , Elon Musk , and other tech execs . ",finance.yahoo.com,https://finance.yahoo.com/news/buy-billionaire-asked-chatgpt-gift-145559179.html,gdelt
MSFT,Satya Nadella,Microsoft,20231119T163000Z,OpenAI investors including Microsoft push to bring Altman BACK as CEO,OpenAI investors including Microsoft push to bring Altman BACK as CEO,OpenAI investors including Microsoft push to bring Altman BACK as CEO,dailymail.co.uk,https://www.dailymail.co.uk/news/article-12767741/OpenAI-investors-Microsoft-Sam-Altman-CEO.html,gdelt
MSFT,Satya Nadella,Microsoft,20231122T200000Z,Every ChatGPT user needs to know what happened at OpenAI this week,Every ChatGPT user needs to know what happened at OpenAI this week,Every ChatGPT user needs to know what happened at OpenAI this week,bgr.com,https://bgr.com/business/every-chatgpt-user-needs-to-know-what-happened-at-openai-this-week/,gdelt
MSFT,Satya Nadella,Microsoft,20231121T083000Z,알트먼 해임 사태 … 오픈AI 이사회  는 패자일까,알트먼 해임 사태 … 오픈AI 이사회  는 패자일까,알트먼 해임 사태 … 오픈AI 이사회  는 패자일까,zdnet.co.kr,https://zdnet.co.kr/view/?no=20231121161239,gdelt
MSFT,Satya Nadella,Microsoft,20231122T201500Z,הכאוס ב ־ OpenAI הוכיח : עובדים הם עדיין המשאב הכי יקר,הכאוס ב ־ OpenAI הוכיח : עובדים הם עדיין המשאב הכי יקר,הכאוס ב ־ OpenAI הוכיח : עובדים הם עדיין המשאב הכי יקר,calcalist.co.il,https://www.calcalist.co.il/calcalistech/article/hymx9hsea,gdelt
MSFT,Satya Nadella,Microsoft,20231117T084500Z,Elon Musk cancels on APEC after antisemitic tweet saga,Elon Musk cancels on APEC after antisemitic tweet saga,Elon Musk cancels on APEC after antisemitic tweet saga,fortune.com,https://fortune.com/2023/11/17/elon-musk-apec-ceo-summit-antisemitic-tweet-x/,gdelt
MSFT,Satya Nadella,Microsoft,20231121T030000Z,OpenAI CEO Emmett Shear Tries to Right Ship Amid Mass Exodus,OpenAI CEO Emmett Shear Tries to Right Ship Amid Mass Exodus,OpenAI CEO Emmett Shear Tries to Right Ship Amid Mass Exodus,bankinfosecurity.com,https://www.bankinfosecurity.com/openai-ceo-emmett-shear-tries-to-right-ship-amid-mass-exodus-a-23649,gdelt
MSFT,Satya Nadella,Microsoft,20231204T054500Z,"Ego , fear and money : How the artificial intelligence fuse was lit","Ego , fear and money : How the artificial intelligence fuse was lit","Ego , fear and money : How the artificial intelligence fuse was lit",indianexpress.com,https://indianexpress.com/article/technology/artificial-intelligence/ego-fear-and-money-how-the-artificial-intelligence-fuse-was-lit-9053519/,gdelt
MSFT,Satya Nadella,Microsoft,20231120T141500Z,Why Sam Altman New Job Could Boost Microsoft Stock,Why Sam Altman New Job Could Boost Microsoft Stock,Why Sam Altman New Job Could Boost Microsoft Stock,forbes.com,https://www.forbes.com/sites/petercohan/2023/11/20/why-sam-altmans-new-job-could-boost-microsoft-stock/,gdelt
MSFT,Satya Nadella,Microsoft,20231122T004500Z,Why The OpenAI Drama Means A Powerful Profit Push Has Begun,Why The OpenAI Drama Means A Powerful Profit Push Has Begun,Why The OpenAI Drama Means A Powerful Profit Push Has Begun,investorplace.com,https://investorplace.com/hypergrowthinvesting/2023/11/why-the-openai-drama-means-a-powerful-profit-push-has-begun/,gdelt
MSFT,Satya Nadella,Microsoft,20231122T100000Z,"Sam Altman To Return To OpenAI , Build On Microsoft Partnership","Sam Altman To Return To OpenAI , Build On Microsoft Partnership","Sam Altman To Return To OpenAI , Build On Microsoft Partnership",forbesindia.com,https://www.forbesindia.com/article/news/sam-altman-to-return-to-openai-build-on-microsoft-partnership/89855/1,gdelt
MSFT,Satya Nadella,Microsoft,20231125T111500Z,Openai Fiasco Triggers Serious Calls For Guardrails Around AI Industry,Openai Fiasco Triggers Serious Calls For Guardrails Around AI Industry,Openai Fiasco Triggers Serious Calls For Guardrails Around AI Industry,menafn.com,https://menafn.com/1107483711/Openai-Fiasco-Triggers-Serious-Calls-For-Guardrails-Around-AI-Industry,gdelt
MSFT,Satya Nadella,Microsoft,20231121T093000Z,Satya Nadella Says Microsoft Has a Place for  All AI Talent  in Wake of OpenAI Drama,Satya Nadella Says Microsoft Has a Place for  All AI Talent  in Wake of OpenAI Drama,Satya Nadella Says Microsoft Has a Place for  All AI Talent  in Wake of OpenAI Drama,todayheadline.co,https://todayheadline.co/satya-nadella-says-microsoft-has-a-place-for-all-ai-talent-in-wake-of-openai-drama/,gdelt
MSFT,Satya Nadella,Microsoft,20231013T223000Z,  Call of Duty  Joins Xbox : Microsoft Finalizes Activision Deal Following Regulatory Approval | HNGN,  Call of Duty  Joins Xbox : Microsoft Finalizes Activision Deal Following Regulatory Approval | HNGN,  Call of Duty  Joins Xbox : Microsoft Finalizes Activision Deal Following Regulatory Approval | HNGN,hngn.com,http://www.hngn.com/articles/252921/20231013/call-duty-joins-xbox-microsoft-finalizes-activision-deal-following-regulatory.htm,gdelt
MSFT,Satya Nadella,Microsoft,20231121T133000Z,Bjyu rejects ED probe findings ; Tesla ready to roll soon from India,Bjyu rejects ED probe findings ; Tesla ready to roll soon from India,Bjyu rejects ED probe findings ; Tesla ready to roll soon from India,economictimes.indiatimes.com,https://economictimes.indiatimes.com/tech/newsletters/tech-top-5/bjyus-rejects-ed-probe-findings-tesla-ready-to-roll-soon-from-india/articleshow/105390217.cms,gdelt
MSFT,Satya Nadella,Microsoft,20231123T024500Z,챗GPT  실리콘밸리의 가장 큰 딜레마 드러냈다  : 경제일반 : 경제 : 뉴스 : 한겨레,챗GPT  실리콘밸리의 가장 큰 딜레마 드러냈다  : 경제일반 : 경제 : 뉴스 : 한겨레,챗GPT  실리콘밸리의 가장 큰 딜레마 드러냈다  : 경제일반 : 경제 : 뉴스 : 한겨레,hani.co.kr,https://www.hani.co.kr/arti/economy/economy_general/1117513.html,gdelt
MSFT,Satya Nadella,Microsoft,20231120T021500Z,Sam Altman Friends and Foes : Who Who in OpenAI Drama,Sam Altman Friends and Foes : Who Who in OpenAI Drama,Sam Altman Friends and Foes : Who Who in OpenAI Drama,finance.yahoo.com,https://finance.yahoo.com/news/sam-altman-friends-foes-openai-171851742.html,gdelt
MSFT,Satya Nadella,Microsoft,20231120T110000Z,Microsoft hires Sam Altman 3 days after OpenAI fired him as CEO,Microsoft hires Sam Altman 3 days after OpenAI fired him as CEO,Microsoft hires Sam Altman 3 days after OpenAI fired him as CEO,cbsnews.com,https://www.cbsnews.com/news/microsoft-hires-fired-openai-ceo-sam-altman/,gdelt
MSFT,Satya Nadella,Microsoft,20231125T150000Z,OpenAI fiasco triggers serious calls for guardrails around AI industry,OpenAI fiasco triggers serious calls for guardrails around AI industry,OpenAI fiasco triggers serious calls for guardrails around AI industry,morungexpress.com,http://morungexpress.com/openai-fiasco-triggers-serious-calls-for-guardrails-around-ai-industry,gdelt
MSFT,Satya Nadella,Microsoft,20231108T023000Z, [ 10분 뉴스정복 ] 윤 대통령은 카카오 택시를 타본 적 없다, [ 10분 뉴스정복 ] 윤 대통령은 카카오 택시를 타본 적 없다, [ 10분 뉴스정복 ] 윤 대통령은 카카오 택시를 타본 적 없다,ohmynews.com,https://www.ohmynews.com/NWS_Web/Series/series_premium_pg.aspx?CNTN_CD=A0002976074&PAGE_CD=N0002&CMPT_CD=M0112,gdelt
MSFT,Satya Nadella,Microsoft,20231120T223000Z,Explaining the Upheaval at OpenAI,Explaining the Upheaval at OpenAI,Explaining the Upheaval at OpenAI,nytimes.com,https://www.nytimes.com/2023/11/20/technology/openai-sam-altman-microsoft.html,gdelt
MSFT,Satya Nadella,Microsoft,20231122T141500Z,The Fallout From Sam Altman Return to OpenAI - The New York Times,The Fallout From Sam Altman Return to OpenAI - The New York Times,The Fallout From Sam Altman Return to OpenAI - The New York Times,nytimes.com,https://www.nytimes.com/2023/11/22/business/dealbook/openai-altman-microsoft-board.html,gdelt
MSFT,Satya Nadella,Microsoft,20231121T180000Z,Microsoft chief says  no OpenAI  without tech giant involvement | Microsoft,Microsoft chief says  no OpenAI  without tech giant involvement | Microsoft,Microsoft chief says  no OpenAI  without tech giant involvement | Microsoft,theguardian.com,https://www.theguardian.com/technology/2023/nov/21/microsoft-ceo-nadella-openai-altman,gdelt
MSFT,Satya Nadella,Microsoft,20231120T141500Z,Sam Altman Ouster at OpenAI Scrambles the A . I . Power Dynamic,Sam Altman Ouster at OpenAI Scrambles the A . I . Power Dynamic,Sam Altman Ouster at OpenAI Scrambles the A . I . Power Dynamic,nytimes.com,https://www.nytimes.com/2023/11/20/business/dealbook/sam-altman-openai-microsoft-google-ai.html,gdelt
MSFT,Satya Nadella,Microsoft,20231025T211500Z,Wall Street sinks sharply as Google parent Alphabet slumps 10pc ; Microsoft an outlier,Wall Street sinks sharply as Google parent Alphabet slumps 10pc ; Microsoft an outlier,Wall Street sinks sharply as Google parent Alphabet slumps 10pc ; Microsoft an outlier,nzherald.co.nz,https://www.nzherald.co.nz/business/wall-street-sinks-sharply-as-google-parent-alphabet-slumps-10pc-microsoft-an-outlier/HOCWPM4G25BMLKDAAB4EC5DRZQ/,gdelt
MSFT,Satya Nadella,Microsoft,20231122T073000Z,Satya Nadella reaction as Sam Altman returns to OpenAI,Satya Nadella reaction as Sam Altman returns to OpenAI,Satya Nadella reaction as Sam Altman returns to OpenAI,hindustantimes.com,https://www.hindustantimes.com/technology/satya-nadellas-reaction-as-sam-altman-returns-to-openai-101700634189057.html,gdelt
MSFT,Satya Nadella,Microsoft,20231122T210000Z,Microsoft CEO Satya Nadella journey to the top seat,Microsoft CEO Satya Nadella journey to the top seat,Microsoft CEO Satya Nadella journey to the top seat,windowscentral.com,https://www.windowscentral.com/microsoft/viral-post-poignantly-shares-satya-nadellas-humble-beginnings-as-an-excel-product-demonstrator-at-microsoft-to-now-running-the-entire-company,gdelt
MSFT,Satya Nadella,Microsoft,20231210T000000Z,Inside OpenAI crisis over the future of artificial intelligence,Inside OpenAI crisis over the future of artificial intelligence,Inside OpenAI crisis over the future of artificial intelligence,staradvertiser.com,https://www.staradvertiser.com/2023/12/09/breaking-news/inside-openais-crisis-over-the-future-of-artificial-intelligence/,gdelt
MSFT,Satya Nadella,Microsoft,20231125T060000Z,쿠데타 진압한 샘 올트먼 오픈AI CEO ... 페이스오프  수면 위로,쿠데타 진압한 샘 올트먼 오픈AI CEO ... 페이스오프  수면 위로,쿠데타 진압한 샘 올트먼 오픈AI CEO ... 페이스오프  수면 위로,hankookilbo.com,https://www.hankookilbo.com/News/Read/A2023112416550005868?topicView=y&stt_op=topic_main_toparea_view&stt_id=dfbea540-4d91-422a-b248-8c8143541f5f?topicView=y&stt_op=topic_main_toparea_view&stt_id=dfbea540-4d91-422a-b248-8c8143541f5f,gdelt
MSFT,Satya Nadella,Microsoft,20231125T060000Z,쿠데타 진압한 샘 올트먼 오픈AI CEO ... 페이스오프  수면 위로,쿠데타 진압한 샘 올트먼 오픈AI CEO ... 페이스오프  수면 위로,쿠데타 진압한 샘 올트먼 오픈AI CEO ... 페이스오프  수면 위로,hankookilbo.com,https://www.hankookilbo.com/News/Read/A2023112416550005868,gdelt
MSFT,Satya Nadella,Microsoft,20231118T184500Z,Many Details of Sam Altman Ouster Are Murky . But Some Things Are Clear . – DNyuz,Many Details of Sam Altman Ouster Are Murky . But Some Things Are Clear . – DNyuz,Many Details of Sam Altman Ouster Are Murky . But Some Things Are Clear . – DNyuz,dnyuz.com,https://dnyuz.com/2023/11/18/many-details-of-sam-altmans-ouster-are-murky-but-some-things-are-clear/,gdelt
MSFT,Satya Nadella,Microsoft,20231205T080000Z,"Ego , fear and money : How the artificial intelligence fuse was lit","Ego , fear and money : How the artificial intelligence fuse was lit","Ego , fear and money : How the artificial intelligence fuse was lit",nzherald.co.nz,https://www.nzherald.co.nz/world/ego-fear-and-money-how-the-artificial-intelligence-fuse-was-lit/5O4JKUFXVFFX3F23LL46CWLLUE/,gdelt
MSFT,Satya Nadella,Microsoft,20231226T221500Z,Microsoft CEO Satya Nadella discusses the promise and potential perils of AI,Microsoft CEO Satya Nadella discusses the promise and potential perils of AI,Microsoft CEO Satya Nadella discusses the promise and potential perils of AI,michiganradio.org,https://www.michiganradio.org/2023-12-26/microsoft-ceo-satya-nadella-discusses-the-promise-and-potential-perils-of-ai,gdelt
MSFT,Satya Nadella,Microsoft,20231222T084500Z,Chanticleer podcast : Why Guzman y Gomez and AirTrunk are companies to watch in 2024,Chanticleer podcast : Why Guzman y Gomez and AirTrunk are companies to watch in 2024,Chanticleer podcast : Why Guzman y Gomez and AirTrunk are companies to watch in 2024,afr.com,https://www.afr.com/companies/financial-services/from-stinky-deals-to-companies-to-watch-in-2024-chanticleer-awards-20231221-p5eszg,gdelt
MSFT,Satya Nadella,Microsoft,20231226T211500Z,Microsoft CEO Satya Nadella discusses the promise and potential perils of AI,Microsoft CEO Satya Nadella discusses the promise and potential perils of AI,Microsoft CEO Satya Nadella discusses the promise and potential perils of AI,kalw.org,https://www.kalw.org/npr-news/2023-12-26/microsoft-ceo-satya-nadella-discusses-the-promise-and-potential-perils-of-ai,gdelt
MSFT,Satya Nadella,Microsoft,20231121T010000Z,"ChatGPT now endangers start - ups , quite like Apple and Google already do - Opinion News","ChatGPT now endangers start - ups , quite like Apple and Google already do - Opinion News","ChatGPT now endangers start - ups , quite like Apple and Google already do - Opinion News",financialexpress.com,https://www.financialexpress.com/opinion/chatgpt-now-endangers-start-ups-quite-like-apple-and-google-already-donbsp/3312382/,gdelt
MSFT,Satya Nadella,Microsoft,20231229T233000Z,Tech stocks just wrapped up one of their best years in past two decades after 2022 slump,Tech stocks just wrapped up one of their best years in past two decades after 2022 slump,Tech stocks just wrapped up one of their best years in past two decades after 2022 slump,nbclosangeles.com,https://www.nbclosangeles.com/news/business/money-report/tech-stocks-just-wrapped-up-one-of-their-best-years-in-past-two-decades-after-2022-slump/3300323/,gdelt
MSFT,Satya Nadella,Microsoft,20231229T233000Z,Tech stocks just wrapped up one of their best years in past two decades after 2022 slump,Tech stocks just wrapped up one of their best years in past two decades after 2022 slump,Tech stocks just wrapped up one of their best years in past two decades after 2022 slump,nbcchicago.com,https://www.nbcchicago.com/news/business/money-report/tech-stocks-just-wrapped-up-one-of-their-best-years-in-past-two-decades-after-2022-slump/3313805/,gdelt
MSFT,Satya Nadella,Microsoft,20231120T230000Z,Satya Nadella And Microsoft Are The Biggest Winners Of The OpenAI Meltdown For Now,Satya Nadella And Microsoft Are The Biggest Winners Of The OpenAI Meltdown For Now,Satya Nadella And Microsoft Are The Biggest Winners Of The OpenAI Meltdown For Now,forbes.com,https://www.forbes.com/sites/davidjeans/2023/11/20/satya-nadella-microsoft-openai-meltdown/,gdelt
MSFT,Satya Nadella,Microsoft,20231004T044500Z," [ 10분 뉴스정복 ] <동아>의 분노  정부 , 뭘 하자는 건지 알 수 없다  "," [ 10분 뉴스정복 ] <동아>의 분노  정부 , 뭘 하자는 건지 알 수 없다  "," [ 10분 뉴스정복 ] <동아>의 분노  정부 , 뭘 하자는 건지 알 수 없다  ",ohmynews.com,https://www.ohmynews.com/NWS_Web/Series/series_premium_pg.aspx?CNTN_CD=A0002966519&PAGE_CD=N0002&CMPT_CD=M0112,gdelt
MSFT,Satya Nadella,Microsoft,20231004T024500Z," [ 10분 뉴스정복 ] <동아>의 분노  정부 , 뭘 하자는 건지 알 수 없다  "," [ 10분 뉴스정복 ] <동아>의 분노  정부 , 뭘 하자는 건지 알 수 없다  "," [ 10분 뉴스정복 ] <동아>의 분노  정부 , 뭘 하자는 건지 알 수 없다  ",ohmynews.com,https://www.ohmynews.com/NWS_Web/Series/series_premium_pg.aspx?CNTN_CD=A0002966519&PAGE_CD=N0002&CMPT_CD=M0111,gdelt
MSFT,Satya Nadella,Microsoft,20231121T080000Z,"Sam Altman  in The Proces Of Joining Microsoft , Satya Nadella Says","Sam Altman  in The Proces Of Joining Microsoft , Satya Nadella Says","Sam Altman  in The Proces Of Joining Microsoft , Satya Nadella Says",forbesindia.com,https://www.forbesindia.com/article/news/sam-altman-in-the-process-of-joining-microsoft-satya-nadella-says/89817/1,gdelt
MSFT,Satya Nadella,Microsoft,20231125T144500Z,OpenAI fiasco triggers serious calls for guardrails around AI industry,OpenAI fiasco triggers serious calls for guardrails around AI industry,OpenAI fiasco triggers serious calls for guardrails around AI industry,sakshipost.com,https://www.sakshipost.com/news/openai-fiasco-triggers-serious-calls-guardrails-around-ai-industry-250449,gdelt
MSFT,Satya Nadella,Microsoft,20231121T071500Z,Firm that created ChatGPT in uproar after Microsoft hires its ousted CEO,Firm that created ChatGPT in uproar after Microsoft hires its ousted CEO,Firm that created ChatGPT in uproar after Microsoft hires its ousted CEO,pennlive.com,https://www.pennlive.com/nation-world/2023/11/firm-that-created-chatgpt-in-uproar-after-microsoft-hires-its-ousted-ceo.html,gdelt
MSFT,Satya Nadella,Microsoft,20231019T144500Z,The Human Element in CXO Transformation : Leading People through Change,The Human Element in CXO Transformation : Leading People through Change,The Human Element in CXO Transformation : Leading People through Change,economictimes.indiatimes.com,https://economictimes.indiatimes.com/jobs/c-suite/the-human-element-in-cxo-transformation-leading-people-through-change/articleshow/104559235.cms,gdelt
MSFT,Satya Nadella,Microsoft,20231205T060000Z,Big Tech : Big Tech muscles in : the 12 months that changed Silicon Valley forever,Big Tech : Big Tech muscles in : the 12 months that changed Silicon Valley forever,Big Tech : Big Tech muscles in : the 12 months that changed Silicon Valley forever,economictimes.indiatimes.com,https://economictimes.indiatimes.com/tech/technology/big-tech-muscles-in-the-12-months-that-changed-silicon-valley-forever/articleshow/105745034.cms,gdelt
MSFT,Satya Nadella,Microsoft,20231206T053000Z,Big tech muscles in : The 12 months that changed Silicon Valley forever,Big tech muscles in : The 12 months that changed Silicon Valley forever,Big tech muscles in : The 12 months that changed Silicon Valley forever,indianexpress.com,https://indianexpress.com/article/technology/artificial-intelligence/big-tech-muscles-in-the-12-months-that-changed-silicon-valley-forever-9056392/,gdelt
MSFT,Satya Nadella,Microsoft,20231117T204500Z,Microsoft plugs Copilot in everywhere at Ignite 2023,Microsoft plugs Copilot in everywhere at Ignite 2023,Microsoft plugs Copilot in everywhere at Ignite 2023,itbusiness.ca,https://www.itbusiness.ca/news/microsoft-plugs-copilot-in-everywhere-at-ignite-2023/126616,gdelt
