ticker,executive,company,published_at,title,description,content,source,url,data_source
TSLA,Elon Musk,Tesla,20231012T154500Z,برنارد أرنو يتصدر قائمة فوربس لأثرياء العالم للمرة الأولى على الإطلاق,برنارد أرنو يتصدر قائمة فوربس لأثرياء العالم للمرة الأولى على الإطلاق,برنارد أرنو يتصدر قائمة فوربس لأثرياء العالم للمرة الأولى على الإطلاق,argaam.com,https://www.argaam.com/ar/article/articledetail/id/1676497,gdelt
TSLA,Elon Musk,Tesla,20231214T004500Z,  더 유연해졌네 … 테슬라 차세대 휴머노이드 공개,  더 유연해졌네 … 테슬라 차세대 휴머노이드 공개,  더 유연해졌네 … 테슬라 차세대 휴머노이드 공개,zdnet.co.kr,https://zdnet.co.kr/view/?no=20231214000618,gdelt
TSLA,Elon Musk,Tesla,20231012T033000Z,기적의 약 없어서 못 판다 … 주가 6 % 급등한 회사,기적의 약 없어서 못 판다 … 주가 6 % 급등한 회사,기적의 약 없어서 못 판다 … 주가 6 % 급등한 회사,hankyung.com,https://www.hankyung.com/article/202310122554i,gdelt
TSLA,Elon Musk,Tesla,20231010T033000Z,  네타냐후 병원 이송 … 혼란 틈타 가짜 뉴스 퍼지는  X - 국민일보,  네타냐후 병원 이송 … 혼란 틈타 가짜 뉴스 퍼지는  X - 국민일보,  네타냐후 병원 이송 … 혼란 틈타 가짜 뉴스 퍼지는  X - 국민일보,news.kmib.co.kr,https://news.kmib.co.kr/article/view.asp?arcid=0018747607&code=61131111&sid1=int,gdelt
TSLA,Elon Musk,Tesla,20231130T193000Z,"反유대 발언에 욕설까지 … 머스크 , X 광고주 더 잃는다","反유대 발언에 욕설까지 … 머스크 , X 광고주 더 잃는다","反유대 발언에 욕설까지 … 머스크 , X 광고주 더 잃는다",newspim.com,https://www.newspim.com/news/view/20231201000004,gdelt
TSLA,Elon Musk,Tesla,20231031T083000Z,"中 비야디 , 2조 순익 사상최고 실적 … 테슬라는 생산량 감축","中 비야디 , 2조 순익 사상최고 실적 … 테슬라는 생산량 감축","中 비야디 , 2조 순익 사상최고 실적 … 테슬라는 생산량 감축",hankyung.com,https://www.hankyung.com/article/202310311282i,gdelt
TSLA,Elon Musk,Tesla,20231215T150000Z,"美 법원  머스크 ,  X 인수  관련 SEC 조사 요구에 응해야  ","美 법원  머스크 ,  X 인수  관련 SEC 조사 요구에 응해야  ","美 법원  머스크 ,  X 인수  관련 SEC 조사 요구에 응해야  ",koreatimes.com,http://www.koreatimes.com/article/20231215/1493714,gdelt
TSLA,Elon Musk,Tesla,20231011T013000Z,케네디 변수 부상 ?… 무소속 출마 6시간만 1천100만 달러 모금  돌풍  ,케네디 변수 부상 ?… 무소속 출마 6시간만 1천100만 달러 모금  돌풍  ,케네디 변수 부상 ?… 무소속 출마 6시간만 1천100만 달러 모금  돌풍  ,koreatimes.com,http://www.koreatimes.com/article/20231010/1484626,gdelt
TSLA,Elon Musk,Tesla,20231126T103000Z,머스크 반유대 지지에 X 광고주 대거 이탈 … 980억 원 손실 위기,머스크 반유대 지지에 X 광고주 대거 이탈 … 980억 원 손실 위기,머스크 반유대 지지에 X 광고주 대거 이탈 … 980억 원 손실 위기,donga.com,https://www.donga.com/news/It/article/all/20231126/122356231/1,gdelt
TSLA,Elon Musk,Tesla,20231129T034500Z,"  이스라엘 학살 현장 보라  하마스 , 머스크 가자지구로 초청","  이스라엘 학살 현장 보라  하마스 , 머스크 가자지구로 초청","  이스라엘 학살 현장 보라  하마스 , 머스크 가자지구로 초청",hankookilbo.com,https://www.hankookilbo.com/News/Read/A2023112909540002329,gdelt
TSLA,Elon Musk,Tesla,20231011T000000Z,美케네디 변수 부상 ?… 무소속 출마 6시간만 150억원 모금  돌풍  ,美케네디 변수 부상 ?… 무소속 출마 6시간만 150억원 모금  돌풍  ,美케네디 변수 부상 ?… 무소속 출마 6시간만 150억원 모금  돌풍  ,yna.co.kr,https://www.yna.co.kr/view/AKR20231011015200071,gdelt
TSLA,Elon Musk,Tesla,20231011T024500Z,이스라엘 - 하마스 전쟁 가짜 뉴스 확산 … 엑스 가장 심해  ,이스라엘 - 하마스 전쟁 가짜 뉴스 확산 … 엑스 가장 심해  ,이스라엘 - 하마스 전쟁 가짜 뉴스 확산 … 엑스 가장 심해  ,news1.kr,https://www.news1.kr/articles/?5194890,gdelt
TSLA,Elon Musk,Tesla,20231118T181500Z," [ 영상 ] 스페이스X 스타십 , 2차 발사 실패 … 폭발 전 마지막 장면"," [ 영상 ] 스페이스X 스타십 , 2차 발사 실패 … 폭발 전 마지막 장면"," [ 영상 ] 스페이스X 스타십 , 2차 발사 실패 … 폭발 전 마지막 장면",news.mt.co.kr,https://news.mt.co.kr/mtview.php?no=2023111823133154282&MTS_P,gdelt
TSLA,Elon Musk,Tesla,20231123T010000Z,  25년까지 전기차 배터리 가격 40 % ↓ … 내연기관차와 원가 비슷 - 헤럴드경제,  25년까지 전기차 배터리 가격 40 % ↓ … 내연기관차와 원가 비슷 - 헤럴드경제,  25년까지 전기차 배터리 가격 40 % ↓ … 내연기관차와 원가 비슷 - 헤럴드경제,biz.heraldcorp.com,http://biz.heraldcorp.com/view.php?ud=20231123000178,gdelt
TSLA,Elon Musk,Tesla,20231111T034500Z,"Meet man betting Rs 83000 crore on EVs , to build factory in India , not Mukesh Ambani , Ratan Tata , Musk ,  met Adani to ... ","Meet man betting Rs 83000 crore on EVs , to build factory in India , not Mukesh Ambani , Ratan Tata , Musk ,  met Adani to ... ","Meet man betting Rs 83000 crore on EVs , to build factory in India , not Mukesh Ambani , Ratan Tata , Musk ,  met Adani to ... ",dnaindia.com,https://www.dnaindia.com/business/report-meet-man-bet-rs-83000-crore-evs-factory-india-mukesh-ambani-ratan-tata-elon-musk-gautam-adani-pham-nhat-vuong-3067948,gdelt
TSLA,Elon Musk,Tesla,20231221T054500Z,"US Considering Hiking Tariffs on China EVs , Solar Products : WSJ","US Considering Hiking Tariffs on China EVs , Solar Products : WSJ","US Considering Hiking Tariffs on China EVs , Solar Products : WSJ",bnnbloomberg.ca,https://www.bnnbloomberg.ca/us-considering-hiking-tariffs-on-china-evs-solar-products-wsj-1.2014384,gdelt
TSLA,Elon Musk,Tesla,20231223T030000Z,"  오픈AI , 새로운 자금 조달 논의 시작 … 기업가치 1천억 달러  ","  오픈AI , 새로운 자금 조달 논의 시작 … 기업가치 1천억 달러  ","  오픈AI , 새로운 자금 조달 논의 시작 … 기업가치 1천억 달러  ",koreatimes.com,http://www.koreatimes.com/article/20231222/1494928,gdelt
META,Mark Zuckerberg,Meta,20231019T083000Z,WhatsApp new feature : seamless multiple account switching,WhatsApp new feature : seamless multiple account switching,WhatsApp new feature : seamless multiple account switching,samaa.tv,https://www.samaa.tv/208732907-whatsapp-s-new-feature-seamless-multiple-account-switching,gdelt
META,Mark Zuckerberg,Meta,20231226T144500Z,Former Employees : Mark Zuckerberg Meta Enabled Child Predators on Instagram and Facebook,Former Employees : Mark Zuckerberg Meta Enabled Child Predators on Instagram and Facebook,Former Employees : Mark Zuckerberg Meta Enabled Child Predators on Instagram and Facebook,breitbart.com,https://www.breitbart.com:443/tech/2023/12/26/former-employees-mark-zuckerbergs-meta-enabled-child-predators-on-instagram-and-facebook/,gdelt
META,Mark Zuckerberg,Meta,20231031T231500Z,Mark Zuckerberg Claims His Twitter Clone  Thread Has Close to 100 Million Users,Mark Zuckerberg Claims His Twitter Clone  Thread Has Close to 100 Million Users,Mark Zuckerberg Claims His Twitter Clone  Thread Has Close to 100 Million Users,breitbart.com,https://www.breitbart.com:443/economy/2023/10/30/mark-zuckerberg-claims-his-twitter-clone-threads-has-close-to-100-million-users/,gdelt
META,Mark Zuckerberg,Meta,20231128T190000Z,"Lawsuit : Mark Zuckerberg Meta  Coveted and Pursued  Users Under 13 on Instagram , Facebook","Lawsuit : Mark Zuckerberg Meta  Coveted and Pursued  Users Under 13 on Instagram , Facebook","Lawsuit : Mark Zuckerberg Meta  Coveted and Pursued  Users Under 13 on Instagram , Facebook",breitbart.com,https://www.breitbart.com:443/tech/2023/11/28/lawsuit-mark-zuckerbergs-meta-coveted-and-pursued-users-under-13-on-instagram/,gdelt
META,Mark Zuckerberg,Meta,20231129T040000Z,"Lawsuit : Mark Zuckerberg Meta  Coveted and Pursued  Users Under 13 on Instagram , Facebook","Lawsuit : Mark Zuckerberg Meta  Coveted and Pursued  Users Under 13 on Instagram , Facebook","Lawsuit : Mark Zuckerberg Meta  Coveted and Pursued  Users Under 13 on Instagram , Facebook",breitbart.com,https://www.breitbart.com:443/politics/2023/11/28/lawsuit-mark-zuckerbergs-meta-coveted-and-pursued-users-under-13-on-instagram/,gdelt
META,Mark Zuckerberg,Meta,20231128T111500Z,The Intelligence : As Zuck would have it,The Intelligence : As Zuck would have it,The Intelligence : As Zuck would have it,biztoc.com,https://biztoc.com/x/a6d884f0502eb8f9,gdelt
META,Mark Zuckerberg,Meta,20231003T141500Z,Facebook and Instagram could charge for ad - free services in EU,Facebook and Instagram could charge for ad - free services in EU,Facebook and Instagram could charge for ad - free services in EU,biztoc.com,https://biztoc.com/x/6dc19c30830b8555,gdelt
META,Mark Zuckerberg,Meta,20231012T051500Z,"After Elon Musk , Now Zuckerberg Meta Urged By EU To Tackle Disinformation : Ensure A  Prompt , Accurate And Complete  Response","After Elon Musk , Now Zuckerberg Meta Urged By EU To Tackle Disinformation : Ensure A  Prompt , Accurate And Complete  Response","After Elon Musk , Now Zuckerberg Meta Urged By EU To Tackle Disinformation : Ensure A  Prompt , Accurate And Complete  Response",biztoc.com,https://biztoc.com/x/29d49fa0faea64dc,gdelt
META,Mark Zuckerberg,Meta,20231101T071500Z,Nick Clegg compares AI clamour to  moral panic  in 80s over video games,Nick Clegg compares AI clamour to  moral panic  in 80s over video games,Nick Clegg compares AI clamour to  moral panic  in 80s over video games,biztoc.com,https://biztoc.com/x/e7c513139ee46b67,gdelt
META,Mark Zuckerberg,Meta,20231207T210000Z,UK accuses Meta of empowering child sexual abusers with encryption roll - out,UK accuses Meta of empowering child sexual abusers with encryption roll - out,UK accuses Meta of empowering child sexual abusers with encryption roll - out,biztoc.com,https://biztoc.com/x/13c42810b4a88790,gdelt
META,Mark Zuckerberg,Meta,20231209T210000Z,"New Mexico Files Lawsuit Against Meta Claiming Facebook , Instagram Steer Child Predators to Kids","New Mexico Files Lawsuit Against Meta Claiming Facebook , Instagram Steer Child Predators to Kids","New Mexico Files Lawsuit Against Meta Claiming Facebook , Instagram Steer Child Predators to Kids",breitbart.com,https://www.breitbart.com:443/tech/2023/12/09/new-mexico-files-lawsuit-against-meta-claiming-facebook-instagram-steer-child-predators-to-kids/,gdelt
META,Mark Zuckerberg,Meta,20231013T120000Z,"Threads now lets you edit posts , and unlike X , you wont have to pay for it","Threads now lets you edit posts , and unlike X , you wont have to pay for it","Threads now lets you edit posts , and unlike X , you wont have to pay for it",phandroid.com,https://phandroid.com/2023/10/13/threads-now-lets-you-edit-posts-and-unlike-x-you-wont-have-to-pay-for-it/,gdelt
META,Mark Zuckerberg,Meta,20231025T223000Z,"Meta Posts 23 % Growth as Ads Rebound , With Profit More Than Doubling","Meta Posts 23 % Growth as Ads Rebound , With Profit More Than Doubling","Meta Posts 23 % Growth as Ads Rebound , With Profit More Than Doubling",biztoc.com,https://biztoc.com/x/9faed27c9296d1dd,gdelt
META,Mark Zuckerberg,Meta,20231012T041500Z,"After Elon Musk , Now Zuckerberg Meta Urged By EU To Tackle Disinformation : Ensure A  Prompt , Accurate And Complete  Response - Meta Platforms ( NASDAQ : META ) ","After Elon Musk , Now Zuckerberg Meta Urged By EU To Tackle Disinformation : Ensure A  Prompt , Accurate And Complete  Response - Meta Platforms ( NASDAQ : META ) ","After Elon Musk , Now Zuckerberg Meta Urged By EU To Tackle Disinformation : Ensure A  Prompt , Accurate And Complete  Response - Meta Platforms ( NASDAQ : META ) ",benzinga.com,https://www.benzinga.com/news/23/10/35211094/after-elon-musk-now-zuckerbergs-meta-urged-by-eu-to-tackle-disinformation-ensure-a-prompt-accurate-a,gdelt
META,Mark Zuckerberg,Meta,20231121T031500Z,"With X Musk under fire , White House launches Threads account for Joe Biden , Kamala Harris","With X Musk under fire , White House launches Threads account for Joe Biden , Kamala Harris","With X Musk under fire , White House launches Threads account for Joe Biden , Kamala Harris",timesofindia.indiatimes.com,https://timesofindia.indiatimes.com/world/us/with-xs-musk-under-fire-white-house-launches-threads-account-for-joe-biden-kamala-harris/articleshow/105369528.cms,gdelt
META,Mark Zuckerberg,Meta,20231017T201500Z,A MySpace Documentary Is Coming To Trigger  Top 8 - Related PTSD,A MySpace Documentary Is Coming To Trigger  Top 8 - Related PTSD,A MySpace Documentary Is Coming To Trigger  Top 8 - Related PTSD,vogue.co.uk,https://www.vogue.co.uk/article/myspace-documentary,gdelt
META,Mark Zuckerberg,Meta,20231031T090000Z,"Mukesh Ambani preparing to take on Mark Zuckerberg , showcases mixed reality smart JioGlass","Mukesh Ambani preparing to take on Mark Zuckerberg , showcases mixed reality smart JioGlass","Mukesh Ambani preparing to take on Mark Zuckerberg , showcases mixed reality smart JioGlass",dnaindia.com,https://www.dnaindia.com/technology/report-mukesh-ambani-preparing-to-take-on-mark-zuckerberg-showcases-mixed-reality-smart-jioglass-3066505,gdelt
META,Mark Zuckerberg,Meta,20231003T193000Z,Mark Zuckerberg Meta cutting jobs in Reality Labs division,Mark Zuckerberg Meta cutting jobs in Reality Labs division,Mark Zuckerberg Meta cutting jobs in Reality Labs division,nypost.com,https://nypost.com/2023/10/03/mark-zuckerbergs-meta-cutting-jobs-in-reality-labs-division/,gdelt
META,Mark Zuckerberg,Meta,20231101T130000Z,"Halloween hijinks , CEO - style : Mark Zuckerberg , Elon Musk mark the holiday","Halloween hijinks , CEO - style : Mark Zuckerberg , Elon Musk mark the holiday","Halloween hijinks , CEO - style : Mark Zuckerberg , Elon Musk mark the holiday",marketwatch.com,https://www.marketwatch.com/story/halloween-hijinks-ceo-style-mark-zuckerberg-elon-musk-and-others-mark-the-holiday-85ef8f33,gdelt
META,Mark Zuckerberg,Meta,20231130T221500Z,CEOs of Social Media Platforms Popular with Teens to Testify Before Senate on Child Safety,CEOs of Social Media Platforms Popular with Teens to Testify Before Senate on Child Safety,CEOs of Social Media Platforms Popular with Teens to Testify Before Senate on Child Safety,breitbart.com,https://www.breitbart.com:443/tech/2023/11/30/ceos-of-social-media-platforms-popular-with-teens-to-testify-before-senate-on-child-safety/,gdelt
META,Mark Zuckerberg,Meta,20231127T071500Z,Are Facebook And Instagram Underreporting Harmful Content ? Mark Zuckerberg Meta Faces More Serious Claims - Meta Platforms ( NASDAQ : META ) ,Are Facebook And Instagram Underreporting Harmful Content ? Mark Zuckerberg Meta Faces More Serious Claims - Meta Platforms ( NASDAQ : META ) ,Are Facebook And Instagram Underreporting Harmful Content ? Mark Zuckerberg Meta Faces More Serious Claims - Meta Platforms ( NASDAQ : META ) ,benzinga.com,https://www.benzinga.com/news/23/11/35953267/are-facebook-and-instagram-underreporting-harmful-content-mark-zuckerbergs-meta-faces-more-serious-c,gdelt
META,Mark Zuckerberg,Meta,20231121T001500Z,"With X Musk under fire , Biden joins rival Threads","With X Musk under fire , Biden joins rival Threads","With X Musk under fire , Biden joins rival Threads",news.yahoo.com,https://news.yahoo.com/xs-musk-under-fire-biden-232830406.html,gdelt
META,Mark Zuckerberg,Meta,20231121T021500Z,"With X Elon Musk Under Fire , US President Joe Biden , Kamala Harris Join Rival Threads","With X Elon Musk Under Fire , US President Joe Biden , Kamala Harris Join Rival Threads","With X Elon Musk Under Fire , US President Joe Biden , Kamala Harris Join Rival Threads",ndtv.com,https://www.ndtv.com/world-news/with-xs-elon-musk-under-fire-us-president-joe-biden-kamala-harris-join-rival-threads-4591001,gdelt
META,Mark Zuckerberg,Meta,20231121T103000Z,"With X Elon Musk under fire , Joe Biden joins rival Threads","With X Elon Musk under fire , Joe Biden joins rival Threads","With X Elon Musk under fire , Joe Biden joins rival Threads",thestar.com.my,https://www.thestar.com.my/tech/tech-news/2023/11/21/with-xs-elon-musk-under-fire-joe-biden-joins-rival-threads,gdelt
META,Mark Zuckerberg,Meta,20231121T050000Z,"With X Musk under fire , Biden joins rival Threads","With X Musk under fire , Biden joins rival Threads","With X Musk under fire , Biden joins rival Threads",thejakartapost.com,https://www.thejakartapost.com/world/2023/11/21/with-xs-musk-under-fire-biden-joins-rival-threads.html,gdelt
META,Mark Zuckerberg,Meta,20231121T053000Z,"With X Musk under fire , Biden joins rival Threads","With X Musk under fire , Biden joins rival Threads","With X Musk under fire , Biden joins rival Threads",gulfnews.com,https://gulfnews.com/technology/media/with-xs-musk-under-fire-biden-joins-rival-threads-1.1700539720170,gdelt
META,Mark Zuckerberg,Meta,20231121T161500Z,"With X Musk Under Fire , Biden Joins Rival Threads • Channels Television","With X Musk Under Fire , Biden Joins Rival Threads • Channels Television","With X Musk Under Fire , Biden Joins Rival Threads • Channels Television",channelstv.com,https://www.channelstv.com/2023/11/21/with-xs-musk-under-fire-biden-joins-rival-threads/,gdelt
META,Mark Zuckerberg,Meta,20231121T024500Z,"With X Musk Under Fire , Biden Joins Rival Threads","With X Musk Under Fire , Biden Joins Rival Threads","With X Musk Under Fire , Biden Joins Rival Threads",ibtimes.com,https://www.ibtimes.com/xs-musk-under-fire-biden-joins-rival-threads-3719031,gdelt
META,Mark Zuckerberg,Meta,20231213T210000Z,Meta Launches First Stage of Threads Interoperability via ActivityPub,Meta Launches First Stage of Threads Interoperability via ActivityPub,Meta Launches First Stage of Threads Interoperability via ActivityPub,socialmediatoday.com,https://www.socialmediatoday.com/news/meta-launches-first-stage-of-threads-interoperability-via-activitypub/702454/,gdelt
META,Mark Zuckerberg,Meta,20231121T063000Z,"With X Musk under fire , Biden joins rival Threads","With X Musk under fire , Biden joins rival Threads","With X Musk under fire , Biden joins rival Threads",iraqinews.com,https://www.iraqinews.com/tech/with-xs-musk-under-fire-biden-joins-rival-threads/,gdelt
META,Mark Zuckerberg,Meta,20231030T170000Z,"Meta unveils paid ad - free option for Facebook , Instagram users in Europe","Meta unveils paid ad - free option for Facebook , Instagram users in Europe","Meta unveils paid ad - free option for Facebook , Instagram users in Europe",nypost.com,https://nypost.com/2023/10/30/business/meta-unveils-paid-ad-free-option-for-facebook-instagram-users-in-europe/,gdelt
META,Mark Zuckerberg,Meta,20231212T194500Z,Tech CEOs Freaked Out About Sam Altman Firing in a Giant Group Chat,Tech CEOs Freaked Out About Sam Altman Firing in a Giant Group Chat,Tech CEOs Freaked Out About Sam Altman Firing in a Giant Group Chat,news.yahoo.com,https://news.yahoo.com/tech-ceos-freaked-sam-altmans-173927878.html,gdelt
META,Mark Zuckerberg,Meta,20231215T171500Z,Mark Zuckerberg $100 Million Hawaiian Compound Features Massive Underground Bunker,Mark Zuckerberg $100 Million Hawaiian Compound Features Massive Underground Bunker,Mark Zuckerberg $100 Million Hawaiian Compound Features Massive Underground Bunker,breitbart.com,https://www.breitbart.com:443/tech/2023/12/15/mark-zuckerbergs-100-million-hawaiian-compound-features-massive-underground-bunker/,gdelt
META,Mark Zuckerberg,Meta,20231027T191500Z,"Shopify Signs at Related , Vornado 85 Tenth Avenue","Shopify Signs at Related , Vornado 85 Tenth Avenue","Shopify Signs at Related , Vornado 85 Tenth Avenue",therealdeal.com,https://therealdeal.com/new-york/2023/10/27/shopify-signs-at-related-vornados-85-tenth-avenue/,gdelt
META,Mark Zuckerberg,Meta,20231220T170000Z,Social Media Giants File Lawsuit to Stop Utah from Protecting Kids Online,Social Media Giants File Lawsuit to Stop Utah from Protecting Kids Online,Social Media Giants File Lawsuit to Stop Utah from Protecting Kids Online,breitbart.com,https://www.breitbart.com:443/tech/2023/12/20/social-media-giants-file-lawsuit-to-stop-utah-from-protecting-kids-online/,gdelt
META,Mark Zuckerberg,Meta,20231121T073000Z,"With X Musk under fire , Biden joins rival Threads","With X Musk under fire , Biden joins rival Threads","With X Musk under fire , Biden joins rival Threads",ewn.co.za,https://ewn.co.za/2023/11/21/with-x-s-musk-under-fire-biden-joins-rival-threads,gdelt
META,Mark Zuckerberg,Meta,20231025T234500Z,"Meta reports Q3 results with drastic net income , revenue increase","Meta reports Q3 results with drastic net income , revenue increase","Meta reports Q3 results with drastic net income , revenue increase",thestar.com.my,https://www.thestar.com.my/news/world/2023/10/26/meta-reports-q3-results-with-drastic-net-income-revenue-increase,gdelt
META,Mark Zuckerberg,Meta,20231201T143000Z,Google Bends the Knee to Canada : Will Pay News Publishers $74 Million for Content,Google Bends the Knee to Canada : Will Pay News Publishers $74 Million for Content,Google Bends the Knee to Canada : Will Pay News Publishers $74 Million for Content,breitbart.com,https://www.breitbart.com:443/the-media/2023/11/30/google-bends-the-knee-to-canada-will-pay-news-publishers-74-million-for-content/,gdelt
META,Mark Zuckerberg,Meta,20231202T003000Z,Mark Zuckerberg Meta Sues FTC Demanding the Right to Monetize Data of Children,Mark Zuckerberg Meta Sues FTC Demanding the Right to Monetize Data of Children,Mark Zuckerberg Meta Sues FTC Demanding the Right to Monetize Data of Children,breitbart.com,https://www.breitbart.com:443/tech/2023/12/01/mark-zuckerbergs-meta-sues-ftc-demanding-the-right-to-monetize-data-of-children/,gdelt
META,Mark Zuckerberg,Meta,20231129T010000Z,"Entertainment giants Disney , Warner retreat from Elon Musk X","Entertainment giants Disney , Warner retreat from Elon Musk X","Entertainment giants Disney , Warner retreat from Elon Musk X",sfchronicle.com,http://www.sfchronicle.com/entertainment/article/disney-pixar-abandon-x-18520174.php,gdelt
META,Mark Zuckerberg,Meta,20231130T204500Z,Elon Musk tells advertisers fleeing X  Go f yourself  ,Elon Musk tells advertisers fleeing X  Go f yourself  ,Elon Musk tells advertisers fleeing X  Go f yourself  ,sfchronicle.com,http://www.sfchronicle.com/bayarea/article/elon-musk-x-bob-iger-advertisers-18524663.php,gdelt
META,Mark Zuckerberg,Meta,20231217T170000Z,Facebook hosts adverts with anti - Semitic phrase  from river to sea  ,Facebook hosts adverts with anti - Semitic phrase  from river to sea  ,Facebook hosts adverts with anti - Semitic phrase  from river to sea  ,telegraph.co.uk,https://www.telegraph.co.uk/business/2023/12/17/facebook-hosts-adverts-phrase-from-river-to-sea/,gdelt
META,Mark Zuckerberg,Meta,20231106T160000Z,"MediaTek launches Dimensity 9300 with new architecture for on - device generative AI apps , ET Telecom","MediaTek launches Dimensity 9300 with new architecture for on - device generative AI apps , ET Telecom","MediaTek launches Dimensity 9300 with new architecture for on - device generative AI apps , ET Telecom",telecom.economictimes.indiatimes.com,https://telecom.economictimes.indiatimes.com/news/devices/mediatek-launches-dimensity-9300-with-new-architecture-for-on-device-generative-ai-apps/105014479,gdelt
META,Mark Zuckerberg,Meta,20231121T103000Z,"With X Musk under fire , Biden joins rival Threads","With X Musk under fire , Biden joins rival Threads","With X Musk under fire , Biden joins rival Threads",techxplore.com,https://techxplore.com/news/2023-11-musk-biden-rival-threads.html,gdelt
META,Mark Zuckerberg,Meta,20231024T194500Z,Arizona joins more than 40 other states suing Meta for features they claim are addictive to teens,Arizona joins more than 40 other states suing Meta for features they claim are addictive to teens,Arizona joins more than 40 other states suing Meta for features they claim are addictive to teens,kjzz.org,https://kjzz.org/content/1861004/az-joins-more-40-other-states-suing-meta-features-they-claim-are-addictive-teens,gdelt
META,Mark Zuckerberg,Meta,20231209T044500Z,Elon Musk Slams Disney CEO Bob Iger :  He Should be Fired Immediately  ,Elon Musk Slams Disney CEO Bob Iger :  He Should be Fired Immediately  ,Elon Musk Slams Disney CEO Bob Iger :  He Should be Fired Immediately  ,breitbart.com,https://www.breitbart.com:443/entertainment/2023/12/08/elon-musk-slams-disney-ceo-bob-iger-he-should-be-fired-immediately/,gdelt
META,Mark Zuckerberg,Meta,20231223T030000Z,Meta Boasts  Fundamental Shift  to Integrate AI in Every Part of Life,Meta Boasts  Fundamental Shift  to Integrate AI in Every Part of Life,Meta Boasts  Fundamental Shift  to Integrate AI in Every Part of Life,newsbusters.org,https://newsbusters.org/blogs/free-speech/catherine-salgado/2023/12/22/meta-boasts-fundamental-shift-integrate-ai-every,gdelt
META,Mark Zuckerberg,Meta,20231206T014500Z,"Zuckerberg sold 6 , 82 , 000 shares of Meta","Zuckerberg sold 6 , 82 , 000 shares of Meta","Zuckerberg sold 6 , 82 , 000 shares of Meta",tarunbharat.com,https://www.tarunbharat.com/zuckerberg-sold-682000-shares-of-meta/,gdelt
